{
  "intro": "Ser, ir, and ver are the three everyday irregular verbs in the imperfect. Use them to describe what someone was like, where someone used to go, and what someone was seeing or watching.",
  "overview": {
    "body": "The forms are era, iba, and veía. They are short, common, and useful for real past descriptions.",
    "use_note": "ser, ir, and ver in imperfect descriptions"
  },
  "examples": [
    {
      "spanish": "Cuando era niño, iba al parque.",
      "english": "When I was a child, I used to go to the park."
    },
    {
      "spanish": "Desde la ventana, veía el río.",
      "english": "From the window, I could see the river."
    }
  ],
  "uses": [
    {
      "heading": "Ser for descriptions",
      "body": "Use ser in the imperfect for identity and descriptions in the past.",
      "examples": [
        {
          "spanish": "Mi escuela era pequeña.",
          "english": "My school was small."
        },
        {
          "spanish": "Ellos eran vecinos.",
          "english": "They were neighbors."
        }
      ]
    },
    {
      "heading": "Ir and ver for repeated scenes",
      "body": "Use ir for repeated movement and ver for what someone saw or watched.",
      "examples": [
        {
          "spanish": "Íbamos al cine los viernes.",
          "english": "We used to go to the movies on Fridays."
        },
        {
          "spanish": "Veíamos las noticias por la noche.",
          "english": "We used to watch the news at night."
        }
      ]
    }
  ],
  "sentences": {
    "affirmative": [
      {
        "spanish": "Yo trabajaba en el centro.",
        "english": "I used to work downtown."
      },
      {
        "spanish": "Tú comías con tu familia.",
        "english": "You used to eat with your family."
      },
      {
        "spanish": "Ella vivía cerca.",
        "english": "She used to live nearby."
      },
      {
        "spanish": "Nosotros íbamos al parque.",
        "english": "We used to go to the park."
      }
    ],
    "negative": [
      {
        "spanish": "Yo no salía mucho.",
        "english": "I did not use to go out much."
      },
      {
        "spanish": "Él no tenía coche.",
        "english": "He did not have a car."
      },
      {
        "spanish": "Nosotras no veíamos televisión.",
        "english": "We did not use to watch TV."
      },
      {
        "spanish": "Ellos no eran vecinos.",
        "english": "They were not neighbors."
      }
    ],
    "questions": [
      {
        "spanish": "¿Trabajabas los sábados?",
        "english": "Did you use to work on Saturdays?"
      },
      {
        "spanish": "¿Ella vivía aquí?",
        "english": "Did she use to live here?"
      },
      {
        "spanish": "¿Íbamos juntos?",
        "english": "Did we use to go together?"
      },
      {
        "spanish": "¿Ustedes veían esa serie?",
        "english": "Did you all use to watch that series?"
      }
    ]
  },
  "exercises": {
    "select": [
      {
        "prompt": "Yo _____ estudiante.",
        "options": [
          "era",
          "fui",
          "soy"
        ],
        "answer": "Yo era estudiante."
      },
      {
        "prompt": "Tú _____ al club.",
        "options": [
          "ibas",
          "fuiste",
          "vas"
        ],
        "answer": "Tú ibas al club."
      },
      {
        "prompt": "Ella _____ el mar.",
        "options": [
          "veía",
          "vio",
          "ve"
        ],
        "answer": "Ella veía el mar."
      },
      {
        "prompt": "Nosotros _____ amigos.",
        "options": [
          "éramos",
          "fuimos",
          "somos"
        ],
        "answer": "Nosotros éramos amigos."
      },
      {
        "prompt": "Ellos _____ al centro.",
        "options": [
          "iban",
          "fueron",
          "van"
        ],
        "answer": "Ellos iban al centro."
      },
      {
        "prompt": "Yo no _____ la pantalla.",
        "options": [
          "veía",
          "vi",
          "veo"
        ],
        "answer": "Yo no veía la pantalla."
      },
      {
        "prompt": "Usted _____ muy amable.",
        "options": [
          "era",
          "fue",
          "es"
        ],
        "answer": "Usted era muy amable."
      },
      {
        "prompt": "Nosotras _____ a la escuela.",
        "options": [
          "íbamos",
          "fuimos",
          "vamos"
        ],
        "answer": "Nosotras íbamos a la escuela."
      },
      {
        "prompt": "Tú _____ las montañas.",
        "options": [
          "veías",
          "viste",
          "ves"
        ],
        "answer": "Tú veías las montañas."
      },
      {
        "prompt": "¿Ustedes _____ vecinos?",
        "options": [
          "eran",
          "fueron",
          "son"
        ],
        "answer": "¿Ustedes eran vecinos?"
      }
    ],
    "complete": [
      {
        "prompt": "Yo ___ estudiante.",
        "answer": "Yo era estudiante."
      },
      {
        "prompt": "Tú ___ al club.",
        "answer": "Tú ibas al club."
      },
      {
        "prompt": "Ella ___ el mar.",
        "answer": "Ella veía el mar."
      },
      {
        "prompt": "Nosotros ___ amigos.",
        "answer": "Nosotros éramos amigos."
      },
      {
        "prompt": "Ellos ___ al centro.",
        "answer": "Ellos iban al centro."
      },
      {
        "prompt": "Yo no ___ la pantalla.",
        "answer": "Yo no veía la pantalla."
      },
      {
        "prompt": "Usted ___ muy amable.",
        "answer": "Usted era muy amable."
      },
      {
        "prompt": "Nosotras ___ a la escuela.",
        "answer": "Nosotras íbamos a la escuela."
      },
      {
        "prompt": "Tú ___ las montañas.",
        "answer": "Tú veías las montañas."
      },
      {
        "prompt": "¿Ustedes ___ vecinos?",
        "answer": "¿Ustedes eran vecinos?"
      }
    ],
    "translate": [
      {
        "prompt": "I was a student.",
        "answer": "Yo era estudiante."
      },
      {
        "prompt": "You used to go to the club.",
        "answer": "Tú ibas al club."
      },
      {
        "prompt": "She could see the sea.",
        "answer": "Ella veía el mar."
      },
      {
        "prompt": "We were friends.",
        "answer": "Éramos amigos."
      },
      {
        "prompt": "They used to go downtown.",
        "answer": "Ellos iban al centro."
      },
      {
        "prompt": "I did not see the screen.",
        "answer": "No veía la pantalla."
      },
      {
        "prompt": "You were very kind.",
        "answer": "Usted era muy amable."
      },
      {
        "prompt": "We used to go to school.",
        "answer": "Íbamos a la escuela."
      },
      {
        "prompt": "You could see the mountains.",
        "answer": "Tú veías las montañas."
      },
      {
        "prompt": "Were you all neighbors?",
        "answer": "¿Ustedes eran vecinos?"
      }
    ]
  },
  "answers": {
    "select": [
      "Yo era estudiante.",
      "Tú ibas al club.",
      "Ella veía el mar.",
      "Nosotros éramos amigos.",
      "Ellos iban al centro.",
      "Yo no veía la pantalla.",
      "Usted era muy amable.",
      "Nosotras íbamos a la escuela.",
      "Tú veías las montañas.",
      "¿Ustedes eran vecinos?"
    ],
    "complete": [
      "Yo era estudiante.",
      "Tú ibas al club.",
      "Ella veía el mar.",
      "Nosotros éramos amigos.",
      "Ellos iban al centro.",
      "Yo no veía la pantalla.",
      "Usted era muy amable.",
      "Nosotras íbamos a la escuela.",
      "Tú veías las montañas.",
      "¿Ustedes eran vecinos?"
    ],
    "translate": [
      "Yo era estudiante.",
      "Tú ibas al club.",
      "Ella veía el mar.",
      "Éramos amigos.",
      "Ellos iban al centro.",
      "No veía la pantalla.",
      "Usted era muy amable.",
      "Íbamos a la escuela.",
      "Tú veías las montañas.",
      "¿Ustedes eran vecinos?"
    ]
  },
  "structure": [
    {
      "pattern": "subject + era/eras/éramos + description",
      "example": "La clase era interesante.",
      "translation": "The class was interesting."
    },
    {
      "pattern": "subject + iba/ibas/íbamos + a + place",
      "example": "Íbamos al mercado los sábados.",
      "translation": "We used to go to the market on Saturdays."
    },
    {
      "pattern": "subject + veía/veías/veíamos + object",
      "example": "Veíamos películas en casa.",
      "translation": "We used to watch movies at home."
    }
  ],
  "wrap_up": [
    {
      "use": "Ser",
      "example": "Ella era muy paciente.",
      "translation": "She was very patient."
    },
    {
      "use": "Ir",
      "example": "Iba al centro cada semana.",
      "translation": "I used to go downtown every week."
    },
    {
      "use": "Ver",
      "example": "Veíamos el partido juntos.",
      "translation": "We used to watch the game together."
    }
  ]
}
